{
  "alpha": 0.0,
  "q0star": 0.0,
  "ell_min": 2,
  "ell_max": 3000,
  "n_points": 3001,
  "thresholds": {
    "primary": 0.01,
    "order2": 0.1
  },
  "derivative_window": 7,
  "derivative_polyorder": 3,
  "H0": 67.36,
  "ombh2": 0.02237,
  "omch2": 0.12,
  "tau": 0.0544,
  "mnu": 0.06,
  "As0": 2.1e-09,
  "ns0": 0.9649,
  "c1": 1.0,
  "c2": -0.04,
  "max_delta_Cl_rel": 0.00040199151219087525
}